"","Title","Author","Subject","Abstract","Meta"
"70","Visual Flow-based Programming Plugin for Brain Computer Interface in Computer-Aided Design","Tong Bill Xu, Saleh Kalantari","Human-Computer Interaction (cs.HC)","Over the last half century, the main application of Brain Computer Interfaces, BCIs has been controlling wheelchairs and neural prostheses or generating text or commands for people with restricted mobility. There has been very limited attention in the field to applications for computer aided design, despite the potential of BCIs to provide a new form of environmental interaction. In this paper we introduce the development and application of Neuron, a novel BCI tool that enables designers with little experience in neuroscience or computer programming to gain access to neurological data, along with established metrics relevant to design, create BCI interaction prototypes, both with digital onscreen objects and physical devices, and evaluate designs based on neurological information and record measurements for further analysis. After discussing the BCI tool development, the article presents its capabilities through two case studies, along with a brief evaluation of the tool performance and a discussion of implications, limitations, and future improvement.","Thu, 20 Jul 2023 16:50:39 UTC (2,676 KB)"
"71","Comparing with Python: Text Analysis in Stata","Xiangtai Zuo (Shutter Zor)","Methodology (stat.ME)","Text analysis is the process of constructing structured data from unstructured textual content, usually implemented in Python. In terms of the principles of text analysis, a computer program with the ability to read a file and match it with a regular expression is all that is needed for basic text analysis. However, few researchers have used Stata as their main text analysis tool. In this paper, I will take a step-by-step approach to the practical process, giving examples of how text analysis can be performed with Stata, and comparing the code and running time with Python.","Wed, 19 Jul 2023 22:24:46 UTC (314 KB)"
"72","Glamour muscles: why having a body is not what it means to be embodied","Shawn L. Beaulieu, Sam Kriegman","Artificial Intelligence (cs.AI)","Embodiment has recently enjoyed renewed consideration as a means to amplify the faculties of smart machines. Proponents of embodiment seem to imply that optimizing for movement in physical space promotes something more than the acquisition of niche capabilities for solving problems in physical space. However, there is nothing in principle which should so distinguish the problem of action selection in physical space from the problem of action selection in more abstract spaces, like that of language. Rather, what makes embodiment persuasive as a means toward higher intelligence is that it promises to capture, but does not actually realize, contingent facts about certain bodies (living intelligence) and the patterns of activity associated with them. These include an active resistance to annihilation and revisable constraints on the processes that make the world intelligible. To be theoretically or practically useful beyond the creation of niche tools, we argue that ""embodiment"" cannot be the trivial fact of a body, nor its movement through space, but the perpetual negotiation of the function, design, and integrity of that body$\unicode{x2013}$that is, to participate in what it means to $\textit{constitute}$ a given body. It follows that computer programs which are strictly incapable of traversing physical space might, under the right conditions, be more embodied than a walking, talking robot.","Mon, 17 Jul 2023 16:09:24 UTC (144 KB)"
"73","Are Large Language Models a Threat to Digital Public Goods? Evidence from Activity on Stack Overflow","Maria del Rio-Chanona, Nadzeya Laurentsyeva, Johannes Wachs","Social and Information Networks (cs.SI)","Large language models like ChatGPT efficiently provide users with information about various topics, presenting a potential substitute for searching the web and asking people for help online. But since users interact privately with the model, these models may drastically reduce the amount of publicly available human-generated data and knowledge resources. This substitution can present a significant problem in securing training data for future models. In this work, we investigate how the release of ChatGPT changed human-generated open data on the web by analyzing the activity on Stack Overflow, the leading online Q\&A platform for computer programming. We find that relative to its Russian and Chinese counterparts, where access to ChatGPT is limited, and to similar forums for mathematics, where ChatGPT is less capable, activity on Stack Overflow significantly decreased. A difference-in-differences model estimates a 16\% decrease in weekly posts on Stack Overflow. This effect increases in magnitude over time, and is larger for posts related to the most widely used programming languages. Posts made after ChatGPT get similar voting scores than before, suggesting that ChatGPT is not merely displacing duplicate or low-quality content. These results suggest that more users are adopting large language models to answer questions and they are better substitutes for Stack Overflow for languages for which they have more training data. Using models like ChatGPT may be more efficient for solving certain programming problems, but its widespread adoption and the resulting shift away from public exchange on the web will limit the open data people and models can learn from in the future.","Fri, 14 Jul 2023 14:22:12 UTC (1,327 KB)"
"74","Exact generalized Turán number for $K_3$ versus suspension of $P_4$","Sayan Mukherjee","Combinatorics (math.CO)","Let $P_4$ denote the path graph on $4$ vertices. The suspension of $P_4$, denoted by $\widehat P_4$, is the graph obtained via adding an extra vertex and joining it to all four vertices of $P_4$. In this note, we demonstrate that for $n\ge 8$, the maximum number of triangles in any $n$-vertex graph not containing $\widehat P_4$ is $\left\lfloor n^2/8\right\rfloor$. Our method uses simple induction along with computer programming to prove a base case of the induction hypothesis.","Mon, 10 Jul 2023 06:54:40 UTC (14 KB)"
"75","Multi-Intent Detection in User Provided Annotations for Programming by Examples Systems","Nischal Ashok Kumar, Nitin Gupta, Shanmukha Guttula, Hima Patel","Artificial Intelligence (cs.AI)","In mapping enterprise applications, data mapping remains a fundamental part of integration development, but its time consuming. An increasing number of applications lack naming standards, and nested field structures further add complexity for the integration developers. Once the mapping is done, data transformation is the next challenge for the users since each application expects data to be in a certain format. Also, while building integration flow, developers need to understand the format of the source and target data field and come up with transformation program that can change data from source to target format. The problem of automatic generation of a transformation program through program synthesis paradigm from some specifications has been studied since the early days of Artificial Intelligence (AI). Programming by Example (PBE) is one such kind of technique that targets automatic inferencing of a computer program to accomplish a format or string conversion task from user-provided input and output samples. To learn the correct intent, a diverse set of samples from the user is required. However, there is a possibility that the user fails to provide a diverse set of samples. This can lead to multiple intents or ambiguity in the input and output samples. Hence, PBE systems can get confused in generating the correct intent program. In this paper, we propose a deep neural network based ambiguity prediction model, which analyzes the input-output strings and maps them to a different set of properties responsible for multiple intent. Users can analyze these properties and accordingly can provide new samples or modify existing samples which can help in building a better PBE system for mapping enterprise applications.","Sat, 8 Jul 2023 12:35:10 UTC (1,765 KB)"
"76","Pushing the Limits of Machine Design: Automated CPU Design with AI","Shuyao Cheng, Pengwei Jin, Qi Guo, Zidong Du, Rui Zhang, Yunhao Tian, Xing Hu, Yongwei Zhao, Yifan Hao, Xiangtao Guan, Husheng Han, Zhengyue Zhao, Ximing Liu, Ling Li, Xishan Zhang, Yuejie Chu, Weilong Mao, Tianshi Chen, Yunji Chen","Artificial Intelligence (cs.AI)","Design activity -- constructing an artifact description satisfying given goals and constraints -- distinguishes humanity from other animals and traditional machines, and endowing machines with design abilities at the human level or beyond has been a long-term pursuit. Though machines have already demonstrated their abilities in designing new materials, proteins, and computer programs with advanced artificial intelligence (AI) techniques, the search space for designing such objects is relatively small, and thus, ""Can machines design like humans?"" remains an open question. To explore the boundary of machine design, here we present a new AI approach to automatically design a central processing unit (CPU), the brain of a computer, and one of the world's most intricate devices humanity have ever designed. This approach generates the circuit logic, which is represented by a graph structure called Binary Speculation Diagram (BSD), of the CPU design from only external input-output observations instead of formal program code. During the generation of BSD, Monte Carlo-based expansion and the distance of Boolean functions are used to guarantee accuracy and efficiency, respectively. By efficiently exploring a search space of unprecedented size 10^{10^{540}}, which is the largest one of all machine-designed objects to our best knowledge, and thus pushing the limits of machine design, our approach generates an industrial-scale RISC-V CPU within only 5 hours. The taped-out CPU successfully runs the Linux operating system and performs comparably against the human-designed Intel 80486SX CPU. In addition to learning the world's first CPU only from input-output observations, which may reform the semiconductor industry by significantly reducing the design cycle, our approach even autonomously discovers human knowledge of the von Neumann architecture.","Wed, 21 Jun 2023 05:50:33 UTC (3,756 KB)[v2] Tue, 27 Jun 2023 07:53:50 UTC (3,756 KB)"
"77","Bianchi period polynomials: Hecke action and congruences","Lewis Combes","Number Theory (math.NT)","Let $\Gamma$ be a Bianchi group associated to one of the five Euclidean imaginary quadratic fields. We show that the space of weight $k$ period polynomials for $\Gamma$ is ``dual'' to the space of weight $k$ modular symbols for $\Gamma$, reflecting the duality between the first and second cohomology groups of Bianchi groups. Using this result, we describe the action of Hecke operators on the space of period polynomials for $\Gamma$ via the Heilbronn matrices.
In the second part of the paper, we numerically investigate congruences between level 1 Bianchi eigenforms via computer programs which implement the Hecke action on spaces of Bianchi period polynomials. Computations with the Hecke action are used to indicate moduli of congruences between the underlying Bianchi forms; we then prove the congruences using the period polynomials. From this we find congruences between genuine Bianchi modular forms and both a base-change Bianchi form and an Eisenstein series. We believe these congruences are the first of their kind in the literature.","Mon, 19 Jun 2023 12:10:25 UTC (23 KB)"
"78","Stacking of Hyperparameter Tuned Models for Tagging Coding Problems","Sathya Krishnan TS, S. Lakshmana Pandian, P. Shunmugapriya","Machine Learning (cs.LG)","Coding problems are problems that require a solution in the form of a computer program. Coding problems are popular among students and professionals as it enhances their skills and career opportunities. An AI system that would help those who practice coding problems would be highly useful and there is a huge potential for such a system. In this work, we propose a model which uses stacking of hyperparameter tuned boosting models to achieve impressive metric scores of 77.8% accuracy and 0.815 PR-AUC on the dataset that was scraped from Codeforces and Leetcode. We open source the dataset and the models developed for this work.","Fri, 16 Jun 2023 03:45:48 UTC (404 KB)[v2] Thu, 6 Jul 2023 10:03:35 UTC (1 KB) (withdrawn)"
"79","Chatbots to ChatGPT in a Cybersecurity Space: Evolution, Vulnerabilities, Attacks, Challenges, and Future Recommendations","Attia Qammar, Hongmei Wang, Jianguo Ding, Abdenacer Naouri, Mahmoud Daneshmand, Huansheng Ning","Cryptography and Security (cs.CR)","Chatbots shifted from rule-based to artificial intelligence techniques and gained traction in medicine, shopping, customer services, food delivery, education, and research. OpenAI developed ChatGPT blizzard on the Internet as it crossed one million users within five days of its launch. However, with the enhanced popularity, chatbots experienced cybersecurity threats and vulnerabilities. This paper discussed the relevant literature, reports, and explanatory incident attacks generated against chatbots. Our initial point is to explore the timeline of chatbots from ELIZA (an early natural language processing computer program) to GPT-4 and provide the working mechanism of ChatGPT. Subsequently, we explored the cybersecurity attacks and vulnerabilities in chatbots. Besides, we investigated the ChatGPT, specifically in the context of creating the malware code, phishing emails, undetectable zero-day attacks, and generation of macros and LOLBINs. Furthermore, the history of cyberattacks and vulnerabilities exploited by cybercriminals are discussed, particularly considering the risk and vulnerabilities in ChatGPT. Addressing these threats and vulnerabilities requires specific strategies and measures to reduce the harmful consequences. Therefore, the future directions to address the challenges were presented.","Mon, 29 May 2023 12:26:44 UTC (3,160 KB)"
"80","Plan B: New ${Z^\prime}$ models for $b\rightarrow sl^+l^-$ anomalies","Ben Allanach, Anna Mullin","High Energy Physics - Phenomenology (hep-ph)","Measurements of $b \rightarrow s \mu^+ \mu^-$ transitions indicate that there may be a new physics field coupling to di-muon pairs associated with the $b$ to $s$ flavour transition. Including the 2022 LHCb reanalysis of $R_K$ and $R_{K^\ast}$, one infers that there may also be associated new physics in $b\rightarrow e^+ e^-$ transitions. Here, we examine the extent of the statistical preference for $Z^\prime$ models coupling to di-electron pairs taking into account the relevant constraints, in particular from experiments at LEP-2. We identify an anomaly-free set of models which interpolates between the $Z^\prime$ not coupling to electrons at all, to one in which there is an equal $Z^\prime$ coupling to muons and electrons (but where in all models in the set, the $Z^\prime$ boson can mediate $b\rightarrow \mu^+ \mu^-$ transitions). A $3B_3-L_e-2L_\mu$ model provides a close-to-optimal fit to the pertinent measurements along the line of interpolation. We have (re-)calculated predictions for the relevant LEP-2 observables in terms of dimension-6 SMEFT operators and put them into the ${\tt flavio2.3.3}$ computer program, so that they are available for global fits.","Wed, 14 Jun 2023 17:59:03 UTC (1,117 KB)[v2] Wed, 5 Jul 2023 13:15:58 UTC (4,690 KB)[v3] Sun, 13 Aug 2023 13:23:00 UTC (4,087 KB)[v4] Thu, 17 Aug 2023 15:08:44 UTC (5,019 KB)[v5] Sat, 2 Mar 2024 12:30:58 UTC (4,847 KB)"
"81","Minimally Comparing Relational Abstract Domains","Kenny Ballou, Elena Sherman","Logic in Computer Science (cs.LO)","Value-based static analysis techniques express computed program invariants as logical formula over program variables. Researchers and practitioners use these invariants to aid in software engineering and verification tasks. When selecting abstract domains, practitioners weigh the cost of a domain against its expressiveness. However, an abstract domain's expressiveness tends to be stated in absolute terms; either mathematically via the sub-polyhedra the domain is capable of describing, empirically using a set of known properties to verify, or empirically via logical entailment using the entire invariant of the domain at each program point. Due to carry-over effects, however, the last technique can be problematic because it tends to provide a simplistic and imprecise comparisons.
We address limitations of comparing, in general, abstract domains via logical entailment in this work. We provide a fixed-point algorithm for including the minimally necessary variables from each domain into the compared formula. Furthermore, we empirically evaluate our algorithm, comparing different techniques of widening over the Zones domain and comparing Zones to an incomparable Relational Predicates domain. Our empirical evaluation of our technique shows an improved granularity of comparison. It lowered the number of more precise invariants when comparing analysis techniques, thus, limiting the prevalent carry-over effects. Moreover, it removed undecidable invariants and lowered the number of incomparable invariants when comparing two incomparable relational abstract domains.","Thu, 25 May 2023 16:18:42 UTC (285 KB)"
"82","Statistics of Feynman amplitudes in $ϕ^4$-theory","Paul-Hermann Balduf","High Energy Physics - Theory (hep-th)","The amplitude of subdivergence-free logarithmically divergent Feynman graphs in $\phi^4$-theory in 4 spacetime dimensions is given by a single number, the Feynman period. We numerically compute the periods of 1.3 million completed graphs, this represents more than 33 million graphs contributing to the beta function. Our data set includes all primitive graphs up to 13 loops, and non-complete samples up to 18 loops, with an accuracy of ca. 4 significant digits. We implement all known symmetries of the period in a new computer program and count them up to 14 loops. Combining the symmetries, we discover relations between periods that had been overlooked earlier. All expected symmetries are respected by the numerical values of periods. We examine the distribution of the numerically computed Feynman periods. We confirm the leading asymptotic growth of the average period with growing loop order, up to a factor of 2. At high loop order, a limiting distribution is reached for the amplitudes near the mean. A small class of graphs, most notably the zigzags, grows significantly faster than the mean and causes the limiting distribution to have divergent moments even when normalized to unit mean. We examine the relation between the period and various properties of the underlying graphs. We confirm the strong correlation with the Hepp bound, the Martin invariant, and the number of 6-edge cuts. We find that, on average, the amplitude of planar graphs is significantly larger than that of non-planar graphs, irrespective of $O(N)$ symmetry. We estimate the primitive contribution to the 18-loop beta function of the $O(N)$-symmetric theory. We find that primitive graphs constitute a large part of the beta function in MS for $L\rightarrow \infty$ loops. The relative contribution of planar graphs increases with growing $N$ and decreases with growing loop order $L$.","Mon, 22 May 2023 21:51:44 UTC (5,903 KB)[v2] Sun, 29 Oct 2023 17:29:30 UTC (6,782 KB)"
"83","QHDL: a Low-Level Circuit Description Language for Quantum Computing","Gilbert Netzer, Stefano Markidis","Emerging Technologies (cs.ET)","This paper proposes a descriptive language called QHDL, akin to VHDL, to program gate-based quantum computing systems. Unlike other popular quantum programming languages, QHDL targets low-level quantum computing programming and aims to provide a common framework for programming FPGAs and gate-based quantum computing systems. The paper presents an initial implementation and design principles of the QHDL framework, including a compiler and quantum computer simulator. We discuss the challenges of low-level integration of streaming models and quantum computing for programming FPGAs and gate-based quantum computing systems.","Tue, 16 May 2023 13:18:27 UTC (105 KB)"
"84","Automatic Differentiation in Prolog","Tom Schrijvers, Birthe van den Berg, Fabrizio Riguzzi","Programming Languages (cs.PL)","Automatic differentiation (AD) is a range of algorithms to compute the numeric value of a function's (partial) derivative, where the function is typically given as a computer program or abstract syntax tree. AD has become immensely popular as part of many learning algorithms, notably for neural networks. This paper uses Prolog to systematically derive gradient-based forward- and reverse-mode AD variants from a simple executable specification: evaluation of the symbolic derivative. Along the way we demonstrate that several Prolog features (DCGs, co-routines) contribute to the succinct formulation of the algorithm. We also discuss two applications in probabilistic programming that are enabled by our Prolog algorithms. The first is parameter learning for the Sum-Product Loop Language and the second consists of both parameter learning and variational inference for probabilistic logic programming.","Sat, 13 May 2023 09:34:53 UTC (41 KB)"
"85","Understanding Automatic Differentiation Pitfalls","Jan Hückelheim, Harshitha Menon, William Moses, Bruce Christianson, Paul Hovland, Laurent Hascoët","Numerical Analysis (math.NA)","Automatic differentiation, also known as backpropagation, AD, autodiff, or algorithmic differentiation, is a popular technique for computing derivatives of computer programs accurately and efficiently. Sometimes, however, the derivatives computed by AD could be interpreted as incorrect. These pitfalls occur systematically across tools and approaches. In this paper we broadly categorize problematic usages of AD and illustrate each category with examples such as chaos, time-averaged oscillations, discretizations, fixed-point loops, lookup tables, and linear solvers. We also review debugging techniques and their effectiveness in these situations. With this article we hope to help readers avoid unexpected behavior, detect problems more easily when they occur, and have more realistic expectations from AD tools.","Fri, 12 May 2023 15:17:11 UTC (1,470 KB)"
"86","Humans are Still Better than ChatGPT: Case of the IEEEXtreme Competition","Anis Koubaa, Basit Qureshi, Adel Ammar, Zahid Khan, Wadii Boulila, Lahouari Ghouti","Software Engineering (cs.SE)","Since the release of ChatGPT, numerous studies have highlighted the remarkable performance of ChatGPT, which often rivals or even surpasses human capabilities in various tasks and domains. However, this paper presents a contrasting perspective by demonstrating an instance where human performance excels in typical tasks suited for ChatGPT, specifically in the domain of computer programming. We utilize the IEEExtreme Challenge competition as a benchmark, a prestigious, annual international programming contest encompassing a wide range of problems with different complexities. To conduct a thorough evaluation, we selected and executed a diverse set of 102 challenges, drawn from five distinct IEEExtreme editions, using three major programming languages: Python, Java, and C++. Our empirical analysis provides evidence that contrary to popular belief, human programmers maintain a competitive edge over ChatGPT in certain aspects of problem-solving within the programming context. In fact, we found that the average score obtained by ChatGPT on the set of IEEExtreme programming problems is 3.9 to 5.8 times lower than the average human score, depending on the programming language. This paper elaborates on these findings, offering critical insights into the limitations and potential areas of improvement for AI-based language models like ChatGPT.","Wed, 10 May 2023 08:16:46 UTC (2,409 KB)"
"87","Can ChatGPT Pass An Introductory Level Functional Language Programming Course?","Chuqin Geng, Yihan Zhang, Brigitte Pientka, Xujie Si","Computers and Society (cs.CY)","The recent introduction of ChatGPT has drawn significant attention from both industry and academia due to its impressive capabilities in solving a diverse range of tasks, including language translation, text summarization, and computer programming. Its capability for writing, modifying, and even correcting code together with its ease of use and access is already dramatically impacting computer science education. This paper aims to explore how well ChatGPT can perform in an introductory-level functional language programming course. In our systematic evaluation, we treated ChatGPT as one of our students and demonstrated that it can achieve a grade B- and its rank in the class is 155 out of 314 students overall. Our comprehensive evaluation provides valuable insights into ChatGPT's impact from both student and instructor perspectives. Additionally, we identify several potential benefits that ChatGPT can offer to both groups. Overall, we believe that this study significantly clarifies and advances our understanding of ChatGPT's capabilities and potential impact on computer science education.","Sat, 29 Apr 2023 20:30:32 UTC (3,167 KB)[v2] Thu, 4 May 2023 00:56:38 UTC (3,167 KB)"
