"","Title","Author","Subject","Abstract","Meta"
"1","Quantum physics, digital computers, and life from a holistic perspective","George F R Ellis","Quantum Physics (quant-ph)","Quantum physics is a linear theory, so it is somewhat puzzling that it can underlie very complex systems such as digital computers and life. This paper investigates how this is possible. Physically, such complex systems are necessarily modular hierarchical structures, with a number of key features. Firstly, they cannot be described by a single wave function: only local wave functions can exist, rather than a single wave function for a living cell, a cat, or a brain. Secondly, the quantum to classical transition is characterised by contextual wave-function collapse shaped by macroscopic elements that can be described classically. Thirdly, downward causation occurs in the physical hierarchy in two key ways: by the downward influence of time dependent constraints, and by creation, modification, or deletion of lower level elements. Fourthly, there are also logical modular hierarchical structures supported by the physical ones, such as algorithms and computer programs, They are able to support arbitrary logical operations, which can influence physical outcomes as in computer aided design and 3-d printing. Finally, complex systems are necessarily open systems, with heat baths playing a key role in their dynamics and providing local arrows of time that agree with the cosmological direction of time that is established by the evolution of the universe.","Sun, 10 Mar 2024 20:46:37 UTC (1,637 KB)"
"2","Harmonic Balance for Differential Constitutive Models under Oscillatory Shear","Shivangi Mittal, Yogesh M. Joshi, Sachin Shanbhag","Soft Condensed Matter (cond-mat.soft)","Harmonic balance (HB) is a popular Fourier-Galerkin method used in the analysis of nonlinear vibration problems where dynamical systems are subjected to periodic forcing. We adapt HB to find the periodic steady-state response of nonlinear differential constitutive models subjected to large amplitude oscillatory shear flow. By incorporating the alternating-frequency-time scheme into HB, we develop a computer program called FLASH (acronym for Fast Large Amplitude Simulation using Harmonic balance), which makes it convenient to apply HB to any differential constitutive model. We validate FLASH by considering two representative constitutive models, viz., the exponential Phan-Thien Tanner model and a nonlinear temporary network model. In terms of accuracy and speed, FLASH outperforms the conventional approach of solving initial value problems by numerical integration via time-stepping methods often by several orders of magnitude. We discuss how FLASH can be conveniently extended for other nonlinear constitutive models, which opens up potential applications in model calibration and selection, and stability analysis.","Sat, 9 Mar 2024 17:35:34 UTC (515 KB)"
"3","Safe Pareto Improvements for Expected Utility Maximizers in Program Games","Anthony DiGiovanni, Jesse Clifton","Computer Science and Game Theory (cs.GT)","Agents in mixed-motive coordination problems such as Chicken may fail to coordinate on a Pareto-efficient outcome. Safe Pareto improvements (SPIs) were originally proposed to mitigate miscoordination in cases where players lack probabilistic beliefs as to how their delegates will play a game; delegates are instructed to behave so as to guarantee a Pareto improvement on how they would play by default. More generally, SPIs may be defined as transformations of strategy profiles such that all players are necessarily better off under the transformed profile. In this work, we investigate the extent to which SPIs can reduce downsides of miscoordination between expected utility-maximizing agents. We consider games in which players submit computer programs that can condition their decisions on each other's code, and use this property to construct SPIs using programs capable of renegotiation. We first show that under mild conditions on players' beliefs, each player always prefers to use renegotiation. Next, we show that under similar assumptions, each player always prefers to be willing to renegotiate at least to the point at which they receive the lowest payoff they can attain in any efficient outcome. Thus subjectively optimal play guarantees players at least these payoffs, without the need for coordination on specific Pareto improvements. Lastly, we prove that renegotiation does not guarantee players any improvements on this bound.","Fri, 8 Mar 2024 07:07:47 UTC (74 KB)"
"4","Fast fitting of spectral lines with Gaussian and hyperfine structure models","Mika Juvela (1), Devika Tharakkal (1) ((1) University of Helsinki)","Astrophysics of Galaxies (astro-ph.GA)","The fitting of spectral lines is a common step in the analysis of line observations and simulations. However, the observational noise, the presence of multiple velocity components, and potentially large data sets make it a non-trivial task. We present a new computer program Spectrum Iterative Fitter (SPIF) for the fitting of spectra with Gaussians or with hyperfine line profiles. The aim is to show the computational efficiency of the program and to use it to examine the general accuracy of approximating spectra with simple models. We describe the implementation of the program. To characterise its performance, we examined spectra with isolated Gaussian components or a hyperfine structure, also using synthetic observations from numerical simulations of interstellar clouds. We examined the search for the globally optimal fit and the accuracy to which single-velocity-component and multi-component fits recover true values for parameters such as line areas, velocity dispersion, and optical depth. The program is shown to be fast, with fits of single Gaussian components reaching on graphics processing units speeds approaching one million spectra per second. This also makes it feasible to use Monte Carlo simulations or Markov chain Monte Carlo calculations for the error estimation. However, in the case of hyperfine structure lines, degeneracies affect the parameter estimation and can complicate the derivation of the error estimates. The use of many random initial values makes the fits more robust, both for locating the global $\chi^2$ minimum and for the selection of the optimal number of velocity components.","Thu, 7 Mar 2024 09:35:43 UTC (1,685 KB)"
"5","Executing Natural Language-Described Algorithms with Large Language Models: An Investigation","Xin Zheng, Qiming Zhu, Hongyu Lin, Yaojie Lu, Xianpei Han, Le Sun","Computation and Language (cs.CL)","Executing computer programs described in natural language has long been a pursuit of computer science. With the advent of enhanced natural language understanding capabilities exhibited by large language models (LLMs), the path toward this goal has been illuminated. In this paper, we seek to examine the capacity of present-day LLMs to comprehend and execute algorithms outlined in natural language. We established an algorithm test set sourced from Introduction to Algorithm, a well-known textbook that contains many representative widely-used algorithms. To systematically assess LLMs' code execution abilities, we selected 30 algorithms, generated 300 random-sampled instances in total, and evaluated whether popular LLMs can understand and execute these algorithms. Our findings reveal that LLMs, notably GPT-4, can effectively execute programs described in natural language, as long as no heavy numeric computation is involved. We believe our findings contribute to evaluating LLMs' code execution abilities and would encourage further investigation and application for the computation power of LLMs.","Fri, 23 Feb 2024 05:31:36 UTC (898 KB)"
"6","Exploring rare-earth Kitaev magnets by massive-scale computational analysis","Seong-Hoon Jang, Yukitoshi Motome","Strongly Correlated Electrons (cond-mat.str-el)","The Kitaev honeycomb model plays a pivotal role in the quest for quantum spin liquids, in which fractional quasiparticles would provide applications in decoherence-free topological quantum computing. The key ingredient is the bond-dependent Ising-type interactions, dubbed the Kitaev interactions, which require strong entanglement between spin and orbital degrees of freedom. This study investigates the identification and design of rare-earth materials displaying robust Kitaev interactions. We scrutinize all possible $4f$ electron configurations, which require up to $6+$ million intermediate states in the perturbation processes, by developing a parallel computational program designed for massive scale calculations. Our analysis reveals a predominant interplay between the isotropic Heisenberg $J$ and anisotropic Kitaev $K$ interactions across all realizations of the Kramers doublets. Remarkably, instances featuring $4f^3$ and $4f^{11}$ configurations showcase the prevalence of $K$ over $J$, presenting unexpected prospects for exploring the Kitaev QSLs in compounds including Nd$^{3+}$ and Er$^{3+}$, respectively. Beyond the Kitaev model, our computational program also proves adaptable to a wide range of $4f$-electron magnets.","Thu, 29 Feb 2024 04:09:50 UTC (8,992 KB)"
"7","From Text to Map: A System Dynamics Bot for Constructing Causal Loop Diagrams","Niyousha Hosseinichimeh, Aritra Majumdar, Ross Williams, Navid Ghaffarzadegan","Human-Computer Interaction (cs.HC)","We introduce and test the System Dynamics Bot, a computer program leveraging a large language model to automate the creation of causal loop diagrams from textual data. To evaluate its performance, we ensembled two distinct databases. The first dataset includes 20 causal loop diagrams and associated texts sourced from the system dynamics literature. The second dataset comprises responses from 30 participants to a vignette, along with causal loop diagrams coded by three system dynamics modelers. The bot uses textual data and successfully identifies approximately sixty percent of the links between variables and feedback loops in both datasets. This paper outlines our approach, provides examples, and presents evaluation results. We discuss encountered challenges and implemented solutions in developing the System Dynamics Bot. The bot can facilitate extracting mental models from textual data and improve model building processes. Moreover, the two datasets can serve as a testbed for similar programs.","Sat, 17 Feb 2024 22:54:25 UTC (484 KB)"
"8","QACP: An Annotated Question Answering Dataset for Assisting Chinese Python Programming Learners","Rui Xiao, Lu Han, Xiaoying Zhou, Jiong Wang, Na Zong, Pengyu Zhang","Computation and Language (cs.CL)","In online learning platforms, particularly in rapidly growing computer programming courses, addressing the thousands of students' learning queries requires considerable human cost. The creation of intelligent assistant large language models (LLMs) tailored for programming education necessitates distinct data support. However, in real application scenarios, the data resources for training such LLMs are relatively scarce. Therefore, to address the data scarcity in intelligent educational systems for programming, this paper proposes a new Chinese question-and-answer dataset for Python learners. To ensure the authenticity and reliability of the sources of the questions, we collected questions from actual student questions and categorized them according to various dimensions such as the type of questions and the type of learners. This annotation principle is designed to enhance the effectiveness and quality of online programming education, providing a solid data foundation for developing the programming teaching assists (TA). Furthermore, we conducted comprehensive evaluations of various LLMs proficient in processing and generating Chinese content, highlighting the potential limitations of general LLMs as intelligent teaching assistants in computer programming courses.","Tue, 30 Jan 2024 13:11:23 UTC (1,075 KB)[v2] Fri, 23 Feb 2024 02:35:41 UTC (1,075 KB)"
"9","SOCIALITE-LLAMA: An Instruction-Tuned Model for Social Scientific Tasks","Gourab Dey, Adithya V Ganesan, Yash Kumar Lal, Manal Shah, Shreyashee Sinha, Matthew Matero, Salvatore Giorgi, Vivek Kulkarni, H. Andrew Schwartz","Computation and Language (cs.CL)","Social science NLP tasks, such as emotion or humor detection, are required to capture the semantics along with the implicit pragmatics from text, often with limited amounts of training data. Instruction tuning has been shown to improve the many capabilities of large language models (LLMs) such as commonsense reasoning, reading comprehension, and computer programming. However, little is known about the effectiveness of instruction tuning on the social domain where implicit pragmatic cues are often needed to be captured. We explore the use of instruction tuning for social science NLP tasks and introduce Socialite-Llama -- an open-source, instruction-tuned Llama. On a suite of 20 social science tasks, Socialite-Llama improves upon the performance of Llama as well as matches or improves upon the performance of a state-of-the-art, multi-task finetuned model on a majority of them. Further, Socialite-Llama also leads to improvement on 5 out of 6 related social tasks as compared to Llama, suggesting instruction tuning can lead to generalized social understanding. All resources including our code, model and dataset can be found through this http URL.","Sat, 3 Feb 2024 01:33:16 UTC (7,698 KB)"
"10","Understanding Growth Mindset Practices in an Introductory Physical Computing Classroom: High School Students' Engagement with Debugging by Design Activities","Luis Morales-Navarro, Deborah A. Fields, Yasmin B. Kafai","Computers and Society (cs.CY)","Background and Context: While debugging is recognized as an essential practice, for many students, encountering bugs can generate emotional responses such as fear and anxiety that can lead to disengagement and the avoidance of computer programming. Growth mindsets can support perseverance and learning in these situations, yet few studies have investigated how growth mindsets emerge in practice amongst K-12 computing students facing physical computing debugging challenges. Objective: We seek to understand what (if any) growth mindset practices high school students exhibited when creating and exchanging buggy physical computing projects for their peers to solve during a Debugging by Design activity as part of their introductory computing course. Method: We focused on moment-to-moment microgenetic analysis of student interactions in designing and solving bugs for others to examine the practices students exhibited that demonstrated the development of a growth mindset and the contexts in which these practices emerged. Findings: We identified five emergent growth mindset practices: choosing challenges that lead to more learning, persisting after setbacks, giving and valuing praise for effort, approaching learning as constant improvement, and developing comfort with failure. Students most often exhibited these practices in peer-to-peer interactions and while making buggy physical computing projects for their peers to solve. Implications: Our analysis contributes to a more holistic understanding of students' social, emotional, and motivational approaches to debugging physical computing projects through the characterization of growth mindset practices. The presented inventory of growth mindset practices may be helpful to further study growth mindset in action in other computing settings.","Fri, 2 Feb 2024 20:17:13 UTC (1,085 KB)[v2] Sun, 11 Feb 2024 22:31:28 UTC (1,086 KB)"
"11","Deep Learning Based Amharic Chatbot for FAQs in Universities","Goitom Ybrah Hailu, Shishay Welay","Computers and Society (cs.CY)","University students often spend a considerable amount of time seeking answers to common questions from administrators or teachers. This can become tedious for both parties, leading to a need for a solution. In response, this paper proposes a chatbot model that utilizes natural language processing and deep learning techniques to answer frequently asked questions (FAQs) in the Amharic language. Chatbots are computer programs that simulate human conversation through the use of artificial intelligence (AI), acting as a virtual assistant to handle questions and other tasks. The proposed chatbot program employs tokenization, normalization, stop word removal, and stemming to analyze and categorize Amharic input sentences. Three machine learning model algorithms were used to classify tokens and retrieve appropriate responses: Support Vector Machine (SVM), Multinomial Naïve Bayes, and deep neural networks implemented through TensorFlow, Keras, and NLTK. The deep learning model achieved the best results with 91.55% accuracy and a validation loss of 0.3548 using an Adam optimizer and SoftMax activation function. The chatbot model was integrated with Facebook Messenger and deployed on a Heroku server for 24-hour accessibility. The experimental results demonstrate that the chatbot framework achieved its objectives and effectively addressed challenges such as Amharic Fidel variation, morphological variation, and lexical gaps. Future research could explore the integration of Amharic WordNet to narrow the lexical gap and support more complex questions.","Fri, 26 Jan 2024 18:37:21 UTC (1,172 KB)"
"12","Towards a low-cost universal access cloud framework to assess STEM students","L.F.S Merchante, Carlos M. Vallez, Carrie Szczerbik","Computers and Society (cs.CY)","Government-imposed lockdowns have challenged academic institutions to transition from traditional face-to-face education into hybrid or fully remote learning models. This transition has focused on the technological challenge of guaranteeing the continuity of sound pedagogy and granting safe access to online digital university services. However, a key requisite involves adapting the evaluation process as well. In response to this need, the authors of this paper tailored and implemented a cloud deployment to provide universal access to online summative assessment of university students in a computer programming course that mirrored a traditional in-person monitored computer laboratory under strictly controlled exam conditions. This deployment proved easy to integrate with the university systems and many commercial proctoring tools. This cloud deployment is not only a solution for extraordinary situations; it can also be adapted daily for online collaborative coding assignments, practical lab sessions, formative assessments, and masterclasses where the students connect using their equipment. Connecting from home facilitates access to education for students with physical disabilities. It also allows participation with their students' own adapted equipment in the evaluation processes, simplifying assessment for those with hearing or visual impairments. In addition to these benefits and the evident commitment to the safety rules, this solution has proven cheaper and more flexible than on-premise equivalent installations.","Wed, 31 Jan 2024 09:45:41 UTC (1,630 KB)"
"13","Learning Agent-based Modeling with LLM Companions: Experiences of Novices and Experts Using ChatGPT & NetLogo Chat","John Chen, Xi Lu, Michael Rejtig, David Du, Ruth Bagley, Michael S. Horn, Uri J. Wilensky","Human-Computer Interaction (cs.HC)","Large Language Models (LLMs) have the potential to fundamentally change the way people engage in computer programming. Agent-based modeling (ABM) has become ubiquitous in natural and social sciences and education, yet no prior studies have explored the potential of LLMs to assist it. We designed NetLogo Chat to support the learning and practice of NetLogo, a programming language for ABM. To understand how users perceive, use, and need LLM-based interfaces, we interviewed 30 participants from global academia, industry, and graduate schools. Experts reported more perceived benefits than novices and were more inclined to adopt LLMs in their workflow. We found significant differences between experts and novices in their perceptions, behaviors, and needs for human-AI collaboration. We surfaced a knowledge gap between experts and novices as a possible reason for the benefit gap. We identified guidance, personalization, and integration as major needs for LLM-based interfaces to support the programming of ABM.","Tue, 30 Jan 2024 16:49:50 UTC (935 KB)[v2] Wed, 31 Jan 2024 20:46:05 UTC (935 KB)"
"14","Knuth's non-associative ""group"" on ${\mathcal P}(\mathbb{N})$","Dominic van der Zypen","General Mathematics (math.GM)","Donald Knuth introduced in The Art of Computer Programming (Vol 4a) a fast approximation to the addition of integers (given in binary) in terms of bit-wise operations by $a + b \; \approx \; a \oplus b \oplus ((a\land b) \ll 1).$ Generalizing this to infinite bit-strings we get a binary operation on ${\mathcal P}(\mathbb{N})$, the power-set of $\mathbb{N}$ (which we identify with the collection of infinite bit-strings). We show that this operation is ``group-like'' in that it has a neutral element, inverses, but it is not associative. There are a lot of questions left, which the author has not been able to answer.","Mon, 11 Dec 2023 15:26:27 UTC (4 KB)"
"15","Automated Assessment of Students' Code Comprehension using LLMs","Priti Oli, Rabin Banjade, Jeevan Chapagain, Vasile Rus","Computers and Society (cs.CY)","Assessing student's answers and in particular natural language answers is a crucial challenge in the field of education. Advances in machine learning, including transformer-based models such as Large Language Models(LLMs), have led to significant progress in various natural language tasks. Nevertheless, amidst the growing trend of evaluating LLMs across diverse tasks, evaluating LLMs in the realm of automated answer assesment has not received much attention. To address this gap, we explore the potential of using LLMs for automated assessment of student's short and open-ended answer. Particularly, we use LLMs to compare students' explanations with expert explanations in the context of line-by-line explanations of computer programs.
For comparison purposes, we assess both Large Language Models (LLMs) and encoder-based Semantic Textual Similarity (STS) models in the context of assessing the correctness of students' explanation of computer code. Our findings indicate that LLMs, when prompted in few-shot and chain-of-thought setting perform comparable to fine-tuned encoder-based models in evaluating students' short answers in programming domain.","Tue, 19 Dec 2023 20:39:12 UTC (28 KB)"
"16","Symbolic Regression of Dynamic Network Models","Govind Gandhi","Neural and Evolutionary Computing (cs.NE)","Growing interest in modelling complex systems from brains to societies to cities using networks has led to increased efforts to describe generative processes that explain those networks. Recent successes in machine learning have prompted the usage of evolutionary computation, especially genetic programming to evolve computer programs that effectively forage a multidimensional search space to iteratively find better solutions that explain network structure. Symbolic regression contributes to these approaches by replicating network morphologies using both structure and processes, all while not relying on the scientists intuition or expertise. It distinguishes itself by introducing a novel formulation of a network generator and a parameter-free fitness function to evaluate the generated network and is found to consistently retrieve synthetically generated growth processes as well as simple, interpretable rules for a range of empirical networks. We extend this approach by modifying generator semantics to create and retrieve rules for time-varying networks. Lexicon to study networks created dynamically in multiple stages is introduced. The framework was improved using methods from the genetic programming toolkit (recombination) and computational improvements (using heuristic distance measures) and used to test the consistency and robustness of the upgrades to the semantics using synthetically generated networks. Using recombination was found to improve retrieval rate and fitness of the solutions. The framework was then used on three empirical datasets - subway networks of major cities, regions of street networks and semantic co-occurrence networks of literature in Artificial Intelligence to illustrate the possibility of obtaining interpretable, decentralised growth processes from complex networks.","Fri, 15 Dec 2023 00:34:45 UTC (2,410 KB)"
"17","Mathematical intuition, deep learning, and Robbins' problem","F. Thomas Bruss","History and Overview (math.HO)","{\bf Abstract.} The present article is an essay about mathematical intuition and Artificial intelligence (A.I.), followed by a guided excursion to a well-known open problem. It has two objectives. The first is to reconcile the way of thinking of a computer program as a sequence of mathematically defined instructions with what we face nowadays with newer developments. The second and major goal is to guide interested readers through the probabilistic intuition behind Robbins' problem and to show why A.I., and in particular Deep Learning, may contribute an essential part in its solution.
This article contains no new mathematical results, and no implementation of deep learning either. Nevertheless, we hope to find through its semi-historic narrative style, with well-known examples and an easily accessible terminology, the interest of mathematicians of different inclinations.","Thu, 14 Dec 2023 23:34:54 UTC (104 KB)"
