"","Title","Author","Subject","Abstract","Meta"
"53","Personalization, Cognition, and Gamification-based Programming Language Learning: A State-of-the-Art Systematic Literature Review","Kashif Ishaq, Atif Alvi","Computers and Society (cs.CY)","Programming courses in computing science are important because they are often the first introduction to computer programming for many students. Many university students are overwhelmed with the information they must learn for an introductory course. The current teacher-lecturer model of learning commonly employed in university lecture halls often results in a lack of motivation and participation in learning. Personalized gamification is a pedagogical approach that combines gamification and personalized learning to motivate and engage students while addressing individual differences in learning. This approach integrates gamification and personalized learning strategies to inspire and involve students while addressing their unique learning needs and differences. A comprehensive literature search was conducted by including 81 studies that were analyzed based on their research design, intervention, outcome measures, and quality assessment. The findings suggest that personalized gamification can enhance student cognition in programming courses by improving motivation, engagement, and learning outcomes. However, the effectiveness of personalized gamification varies depending on various factors, such as the type of gamification elements used, the degree of personalization, and the characteristics of the learners. This paper provides insights into designing and implementing effective personalized gamification interventions in programming courses. The findings could inform educational practitioners and researchers in programming education about the potential benefits of personalized gamification and its implications for educational practice.","Tue, 5 Sep 2023 05:14:23 UTC (1,807 KB)"
"54","Computation of 3D Band Structure and Density of States (DOS) of 14 Face Centered Cubic (FCC) Crystals using Pseudopotentials","Mirza Akbar Ali","Materials Science (cond-mat.mtrl-sci)","Electronic properties of materials are crucial to their ability to function in a wide range of applications, from electronics and energy production to structural materials and biomedicine. Computational methods are crucial in understanding these properties before developing the materials. Based on techniques from Cohen-Bergstresser and Monkhorst-Pack, we developed a computer program to calculate the electronic structure and density of the state of 14 fcc crystals.","Tue, 19 Sep 2023 09:18:18 UTC (520 KB)"
"55","Algebra of Self-Replication","Lawrence S. Moss","Logic in Computer Science (cs.LO)","Typical arguments for results like Kleene's Second Recursion Theorem and the existence of self-writing computer programs bear the fingerprints of equational reasoning and combinatory logic. In fact, the connection of combinatory logic and computability theory is very old, and this paper extends this connection in new ways. In one direction, we counter the main trend in both computability theory and combinatory logic of heading straight to undecidability. Instead, this paper proposes using several very small equational logics to examine results in computability theory itself. These logics are decidable via term rewriting. We argue that they have something interesting to say about computability theory. They are closely related to fragments of combinatory logic which are decidable, and so this paper contributes to the study of such fragments. The paper has a few surprising results such as a classification of quine programs (programs which output themselves) in two decidable fragments. The classification goes via examination of normal forms in term rewriting systems, hence the title of the paper. The classification is an explanation of why all quine programs (in any language) are ""pretty much the same, except for inessential details."" In addition, we study the relational structure whose objects are the programs with the relation ""p expresses q"" meaning that if the program p is run on nothing, then it eventually outputs the program q.","Mon, 18 Sep 2023 16:50:11 UTC (283 KB)[v2] Sun, 19 Nov 2023 14:26:54 UTC (61 KB)"
"56","Sums of products of binomial coefficients mod 2 and 2-regular sequences","Narad Rampersad, Max Wiebe","Number Theory (math.NT)","Wu showed that certain sums of products of binomial coefficients modulo 2 are given by the run length transforms of several famous linear recurrence sequences, such as the positive integers, the Fibonacci numbers, the extended Lucas numbers, and Narayana's cows sequence. In this paper we show that the run length transform of such sequences are 2-regular sequences. This allows us to obtain Wu's results and some new ones using the computer program Walnut, eliminating the need for long technical proofs.","Thu, 7 Sep 2023 20:32:04 UTC (21 KB)"
"57","A Phenomenological Approach to Interactive Knot Diagrams","Lennart Finke, Edmund Weitz","Human-Computer Interaction (cs.HC)","Knot diagrams are among the most common visual tools in topology. Computer programs now make it possible to draw, manipulate and render them digitally, which proves to be useful in knot theory teaching and research. Still, an openly available tool to manipulate knot diagrams in a real-time, interactive way is yet to be developed. We introduce a method of operating on the geometry of the knot diagram itself without any underlying three-dimensional structure that can underpin such an application. This allows us to directly interact with vector graphics knot diagrams while at the same time computing knot invariants in ways proposed by previous work. An implementation of this method is provided.","Fri, 1 Sep 2023 13:22:16 UTC (449 KB)[v2] Wed, 3 Jan 2024 13:49:12 UTC (461 KB)"
"58","The Cone of Mueller Matrices","Martha Takane, J. Ivan Lopez-Reyes, J. Othon Parra-Alcantar","Mathematical Physics (math-ph)","In the study of polarized light, there are two basic notions: the Stokes vectors and the matrices which preserve them, called Mueller matrices. The set of Stokes vectors forms a cone: the Future Light Cone. In this work we will see that the Mueller matrices also form a cone in the vector space of real matrices of size 4X4, called the Mueller Cone. We obtain some properties of the Mueller cone, which in turn will be translated into properties of the Stokes vectors. As an application we will give a computational program to calibrate polarimeters by means of the eigenvectors of Mueller matrices (ECM). We include computational programs to 1. Deduce if a matrix is a Mueller matrix, 2. Give an approximation of a matrix by a Mueller matrix, 3. An approximation of a Mueller matrix by Mueller invertibles, 4. An approximation of a Mueller matrix by a Stokes-cone-primitive Mueller matrix, see (4.7) and 5. An Eigenvalue Calibration Method. All these programs and implementations can be found in
this https URL","Thu, 31 Aug 2023 22:38:04 UTC (76 KB)"
"59","Experimenting with ChatGPT for Spreadsheet Formula Generation: Evidence of Risk in AI Generated Spreadsheets","Simon Thorne","Software Engineering (cs.SE)","Large Language Models (LLM) have become sophisticated enough that complex computer programs can be created through interpretation of plain English sentences and implemented in a variety of modern languages such as Python, Java Script, C++ and Spreadsheets. These tools are powerful and relatively accurate and therefore provide broad access to computer programming regardless of the background or knowledge of the individual using them. This paper presents a series of experiments with ChatGPT to explore the tool's ability to produce valid spreadsheet formulae and related computational outputs in situations where ChatGPT has to deduce, infer and problem solve the answer. The results show that in certain circumstances, ChatGPT can produce correct spreadsheet formulae with correct reasoning, deduction and inference. However, when information is limited, uncertain or the problem is too complex, the accuracy of ChatGPT breaks down as does its ability to reason, infer and deduce. This can also result in false statements and ""hallucinations"" that all subvert the process of creating spreadsheet formulae.","Thu, 31 Aug 2023 19:31:32 UTC (487 KB)"
"60","Implementing Performance Portability of High Performance Computing Programs in the New Golden Age of Chip Architecture","Weifeng Liu, Linping Wu, Xiaowen Xu, Yuren Wang","Hardware Architecture (cs.AR)","As an important goal of high-performance computing, the concept of performance portability has been around for many years. As the failure of Moore's Law, it is no longer feasible to improve computer performance by simply increasing the number of existing hardware. The innovation of high performance computer is imperative, which makes high-performance computers with multiple architectures coexist in the production environment. For example, current high-performance computing nodes often use co-accelerators such like general-purpose GPUs and Intel Xeon Phis to accelerate general-purpose processors. With the flourishing of deep learning, dedicated neural network acceleration chips are also arising. The emergence of co-accelerators with different architectures and their wide application in high-performance computers have challenged the performance portability of programs between high-performance computers with different architectures. This article summarizes the current performance portability technology from the programming model, serial code automatic parallelization, parallel code automatic conversion, etc. at the end of the article, it also summarizes how to use scientific computing function libraries to improve performance and performance portability of a program. Different application scenarios need different implementation technologies to get performance portability. Program developers choose performance portability solutions for their programs. In fact, they balance programming efficiency and optimization effects under various constraints.","Sat, 26 Aug 2023 07:57:55 UTC (951 KB)"
"61","Innovating Computer Programming Pedagogy: The AI-Lab Framework for Generative AI Adoption","Ethan Dickey, Andres Bejarano, Chirayu Garg","Computers and Society (cs.CY)","Over the last year, the ascent of Generative AI (GenAI) has raised concerns about its impact on core skill development, such as problem-solving and algorithmic thinking, in Computer Science students. Preliminary anonymous surveys show that at least 48.5% of our students use GenAI for homework. With the proliferation of these tools, the academic community must contemplate the appropriate role of these tools in education. Neglecting this might culminate in a phenomenon we term the ""Junior-Year Wall,"" where students struggle in advanced courses due to prior over-dependence on GenAI. Instead of discouraging GenAI use, which may unintentionally foster covert usage, our research seeks to answer: ""How can educators guide students' interactions with GenAI to preserve core skill development during their foundational academic years?""
We introduce ""AI-Lab,"" a pedagogical framework for guiding students in effectively leveraging GenAI within core collegiate programming courses. This framework accentuates GenAI's benefits and potential as a pedagogical instrument. By identifying and rectifying GenAI's errors, students enrich their learning process. Moreover, AI-Lab presents opportunities to use GenAI for tailored support such as topic introductions, detailed examples, corner case identification, rephrased explanations, and debugging assistance. Importantly, the framework highlights the risks of GenAI over-dependence, aiming to intrinsically motivate students towards balanced usage. This approach is premised on the idea that mere warnings of GenAI's potential failures may be misconstrued as instructional shortcomings rather than genuine tool limitations.
Additionally, AI-Lab offers strategies for formulating prompts to elicit high-quality GenAI responses. For educators, AI-Lab provides mechanisms to explore students' perceptions of GenAI's role in their learning experience.","Wed, 23 Aug 2023 17:20:37 UTC (35 KB)"
"62","ChatLogo: A Large Language Model-Driven Hybrid Natural-Programming Language Interface for Agent-based Modeling and Programming","John Chen, Uri Wilensky","Human-Computer Interaction (cs.HC)","Building on Papert (1980)'s idea of children talking to computers, we propose ChatLogo, a hybrid natural-programming language interface for agent-based modeling and programming. We build upon previous efforts to scaffold ABM & P learning and recent development in leveraging large language models (LLMs) to support the learning of computational programming. ChatLogo aims to support conversations with computers in a mix of natural and programming languages, provide a more user-friendly interface for novice learners, and keep the technical system from over-reliance on any single LLM. We introduced the main elements of our design: an intelligent command center, and a conversational interface to support creative expression. We discussed the presentation format and future work. Responding to the challenges of supporting open-ended constructionist learning of ABM & P and leveraging LLMs for educational purposes, we contribute to the field by proposing the first constructionist LLM-driven interface to support computational and complex systems thinking.","Wed, 16 Aug 2023 02:21:52 UTC (1,065 KB)"
"63","Data Race Detection Using Large Language Models","Le Chen, Xianzhong Ding, Murali Emani, Tristan Vanderbruggen, Pei-hung Lin, Chuanhua Liao","Machine Learning (cs.LG)","Large language models (LLMs) are demonstrating significant promise as an alternate strategy to facilitate analyses and optimizations of high-performance computing programs, circumventing the need for resource-intensive manual tool creation. In this paper, we explore a novel LLM-based data race detection approach combining prompting engineering and fine-tuning techniques. We create a dedicated dataset named DRB-ML, which is derived from DataRaceBench, with fine-grain labels showing the presence of data race pairs and their associated variables, line numbers, and read/write information. DRB-ML is then used to evaluate representative LLMs and fine-tune open-source ones. Our experiment shows that LLMs can be a viable approach to data race detection. However, they still cannot compete with traditional data race detection tools when we need detailed information about variable pairs causing data races.","Tue, 15 Aug 2023 00:08:43 UTC (1,966 KB)[v2] Tue, 3 Oct 2023 06:09:18 UTC (1,972 KB)"
"64","The ${\cal O}(α_t+α_λ+α_κ)^2$ Correction to the $ρ$ Parameter and its Effect on the W Boson Mass Calculation in the Complex NMSSM","Thi Nhung Dao, Martin Gabelmann, M. Margarete Mühlleitner","High Energy Physics - Phenomenology (hep-ph)","We present the prediction of the electroweak $\rho$ parameter and the $W$ boson mass in the CP-violating Next-to-Minimal Supersymmetric extension of the Standard Model (NMSSM) at the two-loop order. The $\rho$ parameter is calculated at the full one-loop and leading and sub-leading two-loop order $\mathcal{O}(\alpha + \alpha_t\alpha_s + \left(\alpha_t+\alpha_\lambda+\alpha_\kappa\right)^2)$. The new $\Delta \rho$ prediction is incorporated into a prediction of $M_W$ via a full supersymmetric (SUSY) one-loop calculation of $\Delta r$. Furthermore, we include all known state-of-the-art SM higher-order corrections to $\Delta r$. By comparing results for $\Delta \rho$ obtained using on-shell (OS) and $\overline{\mathrm{DR}}$ renormalization conditions in the top/stop sector, we find that the scheme uncertainty is reduced at one-loop order by 55%, at two-loop $\mathcal{O}(\alpha_s\alpha_t)$ by 22%, and at two-loop $\mathcal{O}(\alpha_t+\alpha_\kappa+\alpha_\lambda)^2$ by 16%, respectively. The influence of the two-loop results on the $M_W$ mass prediction is found to be sub-leading. The new calculation is made public in the computer program $\mathrm{\tt NMSSMCALC}$. We perform an extensive comparison in the $W$-mass, Higgs boson mass and the muon anomalous magnetic moment prediction between our calculation and three other publicly available tools and find very good agreement provided that the input parameters and renormalization scales are treated in the same way. Finally, we study the impact of the CP-violating phases on the $W$-mass prediction which is found to be smaller than the overall size of the SUSY corrections.","Tue, 8 Aug 2023 05:43:18 UTC (1,732 KB)"
"65","Synthesizing Programmatic Policies with Actor-Critic Algorithms and ReLU Networks","Spyros Orfanos, Levi H. S. Lelis","Machine Learning (cs.LG)","Programmatically Interpretable Reinforcement Learning (PIRL) encodes policies in human-readable computer programs. Novel algorithms were recently introduced with the goal of handling the lack of gradient signal to guide the search in the space of programmatic policies. Most of such PIRL algorithms first train a neural policy that is used as an oracle to guide the search in the programmatic space. In this paper, we show that such PIRL-specific algorithms are not needed, depending on the language used to encode the programmatic policies. This is because one can use actor-critic algorithms to directly obtain a programmatic policy. We use a connection between ReLU neural networks and oblique decision trees to translate the policy learned with actor-critic algorithms into programmatic policies. This translation from ReLU networks allows us to synthesize policies encoded in programs with if-then-else structures, linear transformations of the input values, and PID operations. Empirical results on several control problems show that this translation approach is capable of learning short and effective policies. Moreover, the translated policies are at least competitive and often far superior to the policies PIRL algorithms synthesize.","Fri, 4 Aug 2023 22:17:32 UTC (220 KB)"
"66","Should we trust web-scraped data?","Jens Foerderer","General Economics (econ.GN)","The increasing adoption of econometric and machine-learning approaches by empirical researchers has led to a widespread use of one data collection method: web scraping. Web scraping refers to the use of automated computer programs to access websites and download their content. The key argument of this paper is that naïve web scraping procedures can lead to sampling bias in the collected data. This article describes three sources of sampling bias in web-scraped data. More specifically, sampling bias emerges from web content being volatile (i.e., being subject to change), personalized (i.e., presented in response to request characteristics), and unindexed (i.e., abundance of a population register). In a series of examples, I illustrate the prevalence and magnitude of sampling bias. To support researchers and reviewers, this paper provides recommendations on anticipating, detecting, and overcoming sampling bias in web-scraped data.","Fri, 4 Aug 2023 10:07:31 UTC (384 KB)"
"67","Blueprinting quantum computing systems","Simon J. Devitt","Quantum Physics (quant-ph)","The development of quantum computing systems has been a staple of academic research since the mid-1990s when the first proposal for physical platforms were proposed using Nuclear Magnetic Resonance and Ion-Trap hardware. These first proposals were very basic, essentially consisting of identifying a physical qubit (two-level quantum system) that could be isolated and controlled to achieve universal quantum computation. Over the past thirty years, the nature of quantum architecture design has changed significantly and the scale of investment, groups and companies involved in building quantum computers has increased exponentially. Architectural design for quantum computers examines systems at scale: fully error-corrected machines, potentially consisting of millions if not billions of physical qubits. These designs increasingly act as blueprints for academic groups and companies and are becoming increasingly more detailed, taking into account both the nature and operation of the physical qubits themselves and also peripheral environmental and control infrastructure that is required for each physical system. In this paper, several architectural structures that I have worked on will be reviewed, each of which has been adopted by either a national quantum computing program or a quantum startup.","Sat, 29 Jul 2023 04:03:05 UTC (2,056 KB)"
"68","WavJourney: Compositional Audio Creation with Large Language Models","Xubo Liu, Zhongkai Zhu, Haohe Liu, Yi Yuan, Meng Cui, Qiushi Huang, Jinhua Liang, Yin Cao, Qiuqiang Kong, Mark D. Plumbley, Wenwu Wang","Sound (cs.SD)","Despite breakthroughs in audio generation models, their capabilities are often confined to domain-specific conditions such as speech transcriptions and audio captions. However, real-world audio creation aims to generate harmonious audio containing various elements such as speech, music, and sound effects with controllable conditions, which is challenging to address using existing audio generation systems. We present WavJourney, a novel framework that leverages Large Language Models (LLMs) to connect various audio models for audio creation. WavJourney allows users to create storytelling audio content with diverse audio elements simply from textual descriptions. Specifically, given a text instruction, WavJourney first prompts LLMs to generate an audio script that serves as a structured semantic representation of audio elements. The audio script is then converted into a computer program, where each line of the program calls a task-specific audio generation model or computational operation function. The computer program is then executed to obtain a compositional and interpretable solution for audio creation. Experimental results suggest that WavJourney is capable of synthesizing realistic audio aligned with textually-described semantic, spatial and temporal conditions, achieving state-of-the-art results on text-to-audio generation benchmarks. Additionally, we introduce a new multi-genre story benchmark. Subjective evaluations demonstrate the potential of WavJourney in crafting engaging storytelling audio content from text. We further demonstrate that WavJourney can facilitate human-machine co-creation in multi-round dialogues. To foster future research, the code and synthesized audio are available at: this https URL.","Wed, 26 Jul 2023 17:54:04 UTC (15,404 KB)[v2] Sun, 26 Nov 2023 14:12:37 UTC (23,284 KB)"
"69","Advanced Monte Carlo simulation techniques to study polymers under equilibrium conditions","Monika Angwani, Tushar Mahendrakar, Kaustubh Rane","Soft Condensed Matter (cond-mat.soft)","The advances in materials and biological sciences have necessitated the use of molecular simulations to study polymers. The Markov chain Monte Carlo simulations enable the sampling of relevant microstates of polymeric systems by traversing paths that are impractical in molecular dynamics simulations. Several advances in applying Monte Carlo simulations to polymeric systems have been reported in recent decades. The proposed methods address sampling challenges encountered in studying different aspects of polymeric systems. Tracking the above advances has become increasingly challenging due to the extensive literature generated in the field. Moreover, the incorporation of new methods in the existing Monte Carlo simulation packages is cumbersome due to their complexity. Identifying the foundational algorithms that are common to different methods can significantly ease their implementation and make them accessible to the broader simulation community. The present chapter classifies the Monte Carlo methods for polymeric systems based on their objectives and standard features of their algorithms. We begin the article by providing an overview of advanced Monte Carlo techniques used for polymeric systems and their specific applications. We then classify the above techniques into two broad categories: 1) Monte Carlo moves and 2) Advanced sampling schemes. The former category is further divided to distinguish the Monte Carlo moves in the canonical and other ensembles. The advanced sampling schemes attempt to improve Monte Carlo sampling via approaches other than Monte Carlo moves. We use the above classification to identify common features of the methods and derive general expressions that explain their implementation. Such a strategy can help readers select the methods that are suitable for their study and develop computer programs that can be easily modified to implement new methods.","Fri, 21 Jul 2023 17:30:53 UTC (557 KB)"
